Position,Category,Salary Range,Posted Date,Detail URL,Job Description,Required Skills,Responsibilities
Scientific Research Analyst (Global),Data Analysis,$15 - $20/hr,"Jun 25, 2025",https://experts.afterquery.com/apply/sci-analyst-global,"This position is for experts based OUTSIDE the US, Canada and EU. All experts based in those regions, please apply to the 'US/EU ONLY' position.
This is a remote, part-time role supporting scientific research interpretation. You'll work with experimental results, compound data, and statistical comparisons. You'll help develop AI models capable of understanding scientific logic and process.","Strong foundation in scientific method and quantitative reasoning
Comfort analyzing charts with statistical significance measures
Excited to improve the future of AI applications","Create instruction sets and explanations for scientific charts and tables
Ensure clarity and methodological soundness in outputs
Label and write according to standardized format and structure"
Scientific Research Analyst (US/EU ONLY),Data Analysis,$25 - $40/hr,"Jun 25, 2025",https://experts.afterquery.com/apply/sci-research,"This position is for experts based in the US, Canada and EU ONLY. All others, please apply to the 'Global' position.
This is a remote, part-time role supporting scientific research interpretation. You'll work with experimental results, compound data, and statistical comparisons. You'll help develop AI models capable of understanding scientific logic and process.","Strong foundation in scientific method and quantitative reasoning
Comfort analyzing charts with statistical significance measures
Excited to improve the future of AI applications","Create instruction sets and explanations for scientific charts and tables
Ensure clarity and methodological soundness in outputs
Label and write according to standardized format and structure"
Security Engineer (non-US only),Coding,Undisclosed,"Apr 17, 2025",https://experts.afterquery.com/apply/security-engineer,"AfterQuery is hiring exceptional security engineers for a special project in partnership with one of the top AI model labs. Your work will directly contribute to advancing the coding abilities of the world's best large language models (LLMs) by creating high-quality vulnerability benchmark examples. In this role, you will leverage your expertise in security analysis and remediation to generate detailed benchmark ""rows"" (each row representing a fully annotated vulnerability case) drawn from pre-existing repositories.","Security Engineering Experience: Proven experience identifying and fixing software vulnerabilities across real-world codebases.
Programming Proficiency: Strong coding skills in at least one major language (e.g., Python, JavaScript, C/C++, or Java).
English Communication: Able to write and speak clear, fluent, and professional technical documentation in English.
Time Commitment: Available to start ASAP contribute 20 hours+ from the 21st to the 27th of April.","Vulnerability Analysis: Identify and analyze security vulnerabilities (e.g., OWASP Top 10, CWE Top 25, injection flaws, memory safety issues) within pre-existing repositories.
Golden Patch Creation: Develop secure, effective patches that resolve the identified vulnerabilities without compromising functionality.
Test Case Development: Design test cases that clearly demonstrate the presence of the vulnerability in the original code and verify its elimination post-remediation.
Detailed Annotation: Document each benchmark row with clear descriptions, including vulnerability type, severity levels, and a comprehensive explanation of both the vulnerability's impact and the applied fix."
Senior Marketing Engineer,Marketing,$35 - $75/hr,"Apr 14, 2025",https://experts.afterquery.com/apply/senior-marketing,senior-marketingsenior-marketingsenior-marketing,,
Sports Analytics Expert (Global),Data Analysis,$15 - $20/hr,"Jun 25, 2025",https://experts.afterquery.com/apply/sports-analytics-global,"This position is for candidates based OUTSIDE the US, Canada and EU. Candidates based in those regions, please apply through the 'US/EU ONLY' position.
This is a remote, part-time role for sports data analysis. You'll evaluate and annotate tables that contain player stats, team records, and league analytics. You'll create reasoning steps to teach AI how to interpret and evaluate sports outcomes.","Strong familiarity with sports statistics and game analytics
Proficient in Excel or sports data dashboards
Excited to improve the future of AI applications","Write problem sets based on player or team performance data
Explain statistical outcomes and trends from game records
Ensure clarity, consistency, and sports-specific accuracy"
Sports Analytics Expert (US/EU ONLY),Data Analysis,$25 - $40/hr,"Jun 25, 2025",https://experts.afterquery.com/apply/sports-analytics-expert,"This position is for experts based in the US, Canada or EU ONLY. All others, please apply to the 'Global' position.
This is a remote, part-time role for sports data analysis. You'll evaluate and annotate tables that contain player stats, team records, and league analytics. You'll create reasoning steps to teach AI how to interpret and evaluate sports outcomes.","Strong familiarity with sports statistics and game analytics
Proficient in Excel or sports data dashboards
Excited to improve the future of AI applications","Write problem sets based on player or team performance data
Explain statistical outcomes and trends from game records
Ensure clarity, consistency, and sports-specific accuracy"
Strategic Projects Lead (Full-time),Strategy And Operations,"120,000 - 300,000 / yr","Apr 4, 2025",https://experts.afterquery.com/apply/spl,"AfterQuery is seeking exceptional candidates for our Strategic Projects Lead position. This is
not a typical job – you'll work directly with our founding team on high-priority projects spanning
product development, research, and operations.

Compensation
Base Salary: $110,000 - $150,000
Total Compensation: up to $300k in cash comp in addition to equity","Intense work ethic, agency, and drive
Passion for AI and interest in entrepreneurship
Competitive nature and demonstrated past success
Strong leadership experience and communication skills","Work closely with the world's leading AI labs to generate next generation datasets to push the boundaries of AI to the limits, directly generating revenue for the company
Manage teams of experts across a wide variety of domains, like finance, software engineering, and sciences
Collaborate with internal teams to develop groundbreaking AI research
Drive initiatives across the company as an early hire
Support the team across various operational initiatives"
Supply Chain Analyst Expert,Supply Chain,$35 - $75/hr,"Mar 24, 2025",https://experts.afterquery.com/apply/supply-chain-analyst,"This is a remote, part-time project-based role focused on generating Excel-based supply chain models and PowerPoint summaries. You'll simulate workflows like those used in demand planning, procurement, inventory management, and logistics. Projects are asynchronous and flexible, with ~10 hours/week expected when active.","Degree in Supply Chain, Industrial Engineering, Operations, or related field
Proficiency in Excel for logistics or supply chain modeling
Familiarity with supply planning concepts like EOQ, reorder point, safety stock
Excited to improve the future of AI applications","Build Excel simulations of order cycles, inventory flow, lead times, and vendor cost scenarios
Create PowerPoint decks presenting network designs, transportation tradeoffs, and performance summaries
Produce mock deliverables typical of internal supply chain teams or logistics consulting engagements"
SWE Test,Software,$35 - $75/hr,"May 17, 2025",https://experts.afterquery.com/apply/swe-test,testestestest,,
