Position,Category,Salary Range,Posted Date,Detail URL,Job Description,Required Skills,Responsibilities
Lead Security Engineer (non-US),Security-Engineer,Undisclosed,"Apr 17, 2025",https://experts.afterquery.com/apply/lead-securityengineer,"AfterQuery is hiring exceptional Lead Security Engineers for a special project in partnership with one of the top AI model labs. Your work will directly contribute to advancing the coding abilities of the world's best large language models (LLMs) by creating high-quality vulnerability benchmark examples. In this role, you will leverage your expertise in security analysis and remediation to help us assess and review detailed benchmark ""rows"" (each row representing a fully annotated vulnerability case) drawn from pre-existing repositories. To be eligible, you need to be able to start working as soon as possible and be able contribute 20 hours+ from the 21st to the 27th of April.","Security Engineering Experience: 2-3+ years Proven experience identifying and fixing software vulnerabilities across real-world codebases.
Programming Proficiency: Strong coding skills in at least one major language (e.g., Python, JavaScript, C/C++, or Java).
Time Commitment: Available to start ASAP contribute 20 hours+ from the 21st to the 27th of April.","Vulnerability Analysis: Identify and analyze security vulnerabilities (e.g., OWASP Top 10, CWE Top 25, injection flaws, memory safety issues) within pre-existing repositories.
Golden Patch Creation: Develop secure, effective patches that resolve the identified vulnerabilities without compromising functionality.
Test Case Development: Design test cases that clearly demonstrate the presence of the vulnerability in the original code and verify its elimination post-remediation.
Detailed Annotation: Document each benchmark row with clear descriptions, including vulnerability type, severity levels, and a comprehensive explanation of both the vulnerability's impact and the applied fix."
Legal / Compliance Analyst (Reporting-Focused) Expert,Legal,$35 - $75/hr,"Mar 25, 2025",https://experts.afterquery.com/apply/legal-compliance-analyst,"In this part-time Legal / Compliance Analyst role, you'll replicate the day-to-day reporting and auditing tasks
of corporate legal teams or compliance departments. Projects typically involve creating Excel checklists for regulatory deadlines,
maintaining logs of outstanding issues, and summarizing key legal or policy changes in clear PowerPoint decks for leadership.

By providing thorough, realistic samples of compliance processes, you will support AfterQuery's goal of training AI to navigate
real-world legal and regulatory complexities.","Previous experience with compliance, legal operations, or audit functions
Proficiency in Excel for scheduling, tracking, and risk logs
Skilled in creating concise and clear PowerPoint presentations for non-legal audiences","Develop Excel tools for tracking compliance deadlines, risk items, and resolution status
Create PowerPoint decks summarizing legal risks, policy changes, and recommended actions
Ensure data accuracy and maintain strict data privacy standards
Coordinate with stakeholders to gather documentation or approvals"
Legal JD Expert,Legal,$40 - $80/hr,"Apr 13, 2025",https://experts.afterquery.com/apply/legal-jd-expert,"AfterQuery is seeking Legal JD Experts to create and refine legal reasoning challenges for our AI training modules. In this remote, flexible role, you will design and evaluate legal scenarios that test the AI's ability to interpret and apply complex legal principles, ensuring that our models can navigate real-world legal issues with precision and nuance. Your expertise will help bridge the gap between rigorous legal practice and innovative AI solutions, making a tangible impact on the future of legal technology.","Juris Doctor (JD) degree from an accredited law school.
Proven experience in legal practice, research, or academia with a robust understanding of various legal disciplines.
Exceptional analytical, written, and verbal communication skills, with a keen eye for detail.","Develop high-quality legal questions and case studies that challenge AI models on topics such as contract law, constitutional law, intellectual property, and more.
Evaluate and validate model responses, offering detailed feedback to ensure logical consistency and adherence to legal principles.
Collaborate with a team of legal and technical experts to fine-tune question difficulty and ensure content is both challenging and educational."
Machine Learning PhD Expert,Ml Research,$35 - $75/hr,"Apr 13, 2025",https://experts.afterquery.com/apply/machine-learning-phd-expert,"AfterQuery is looking for a Machine Learning PhD Expert to develop and evaluate rigorous machine learning challenges for our cutting-edge AI systems. In this remote, flexible role, you'll design innovative prompts that mirror real-world machine learning problems and critically assess the model-generated solutions for accuracy and depth. Your expertise will drive improvements in AI training, ensuring our prompts reflect the latest research trends and practical applications in the field.","PhD in Machine Learning, Computer Science, or a closely related field with a strong research background.
A minimum of 2 years of experience in machine learning research or applied projects within an academic or industry setting.
Deep understanding of machine learning algorithms, deep learning frameworks, and model evaluation techniques.","Design high-quality, technically challenging ML problems that emphasize advanced algorithmic reasoning and practical applications.
Evaluate and validate model responses to ensure scientific rigor and accuracy in machine learning concepts.
Collaborate with our team to refine problem difficulty, ensuring balanced engagement across diverse expertise levels.
Provide actionable feedback to continuously enhance the quality and effectiveness of AI training datasets."
Marketing Analyst Expert,Marketing,$35 - $70/hr,"Mar 24, 2025",https://experts.afterquery.com/apply/marketing-analyst,"This is a remote, part-time marketing role focused on building Excel-based marketing performance dashboards and PowerPoint campaign summaries. You'll produce outputs similar to those used by marketing teams. Projects are asynchronous and flexible, with ~10 hours/week expected when active.","Background in marketing analytics, brand strategy, or growth marketing
Strong proficiency in Excel and PowerPoint for marketing use cases
Familiarity with KPIs, paid media metrics, and funnel logic
Excited to improve the future of AI applications","Create Excel models including channel performance (ROAS, CPA, CTR), cohort analysis, attribution modeling
Build polished PowerPoint decks that simulate campaign retros, brand strategy plans, go-to-market proposals, and more
Construct frameworks for customer segmentation, funnel optimization, and A/B testing"
Math Expert,Mathematics,$40 - $48/hr,"Mar 30, 2025",https://experts.afterquery.com/apply/math-expert,"This is a remote, part-time math-related role. You'll help benchmark and improve AI models by solving and analyzing challenging math and data problems. Work is asynchronous and flexible, with ~10 hours/week expected when active.","Strong proficiency in Mathematics
Degree (completed or expected) in Mathematics, Computer Science, Engineering, or related-field
Excited to improve the future of AI applications","Analyze and solve advanced mathematical problems involving combinatorics, algebra, geometry, and number theory with speed and accuracy
Identify logical flaws in complex solutions and provide clear, concise corrections and justifications
Design and evaluate creative, constraint-based mathematical challenges, ensuring rigor and uniqueness in solutions"
Math Olympiad Expert,Mathematics,$40 - $60/hr,"Apr 13, 2025",https://experts.afterquery.com/apply/math-olympiad-expert,"AfterQuery is seeking Math Olympiad Experts to develop and assess mathematically rigorous challenges tailored for our advanced AI models. In this remote, project-based role, you will design and refine problems that echo the high-level reasoning demanded by international math competitions, ensuring our AI systems are pushed to achieve precise analytical thought processes. Your experience in prestigious math competitions will be invaluable in elevating the quality of our training datasets.","Proven participation in the International Math Olympiad (or reasonably similar level) within the past 10 years, demonstrating a high level of mathematical proficiency.
Ideally, a medalist or distinction recipient from the Math Olympiad, showcasing exceptional problem-solving skills.
Strong English proficiency, both written and verbal, to ensure clear communication of problem statements and feedback.","Create and fine-tune challenging math problems that reflect the complexity and depth typical of international math competitions.
Evaluate and validate AI-generated solutions, providing insightful feedback to improve accuracy and logical coherence.
Collaborate with the team to adjust problem difficulty levels to suit various stages of AI model training."
Math PhD Expert,Mathematics,$40 - $60/hr,"Apr 13, 2025",https://experts.afterquery.com/apply/math-phd-expert,"AfterQuery is seeking Math PhD Experts to drive the development and assessment of high-level mathematical challenges for our AI training modules. In this remote, flexible role, you'll work alongside top AI researchers to design and validate problems that test and enhance advanced reasoning in areas such as analysis, algebra, and topology. Your deep expertise in mathematics will be pivotal in ensuring our models tackle complex problem-solving with academic rigor and innovative precision.","PhD in Mathematics or a closely related field with demonstrable expertise in advanced mathematical concepts.
Strong analytical and problem-solving skills coupled with exceptional written and verbal communication abilities.
Proven experience in academic research, teaching, or high-level mathematical problem solving.","Develop, refine, and validate challenging math problems spanning graduate-level topics such as Analysis, Modern Algebra, Topology, Geometry, Numerical Analysis, Combinatorics, and more.
Collaborate with AI researchers to align problem difficulty and scope with real-world applications and current academic standards.
Provide detailed, actionable feedback on problem solutions to enhance the AI's analytical capabilities and logical reasoning."
Medical Data Analyst (Global),Data Analysis,$15 - $20/hr,"Jun 25, 2025",https://experts.afterquery.com/apply/med-data-global,"This position is for experts based OUTSIDE the US, Canada, and EU. All experts based in those regions, please apply to the 'US/EU ONLY' position.
This is a remote, part-time role in medical data annotation. You'll interpret medical tables such as clinical trial results, lab reports, and treatment comparisons. You'll write problem sets and explanations to help train medical reasoning in AI systems.","Ability to interpret medical tables and statistical results
Familiarity with medical terminology and study design
Excited to improve the future of AI applications","Write explanations based on clinical or lab-based data
Generate instruction-based reasoning to evaluate medical tables
Follow a high standard of accuracy and documentation"
Medical Data Analyst (US/EU ONLY),Data Analysis,$25 - $40/hr,"Jun 25, 2025",https://experts.afterquery.com/apply/med-analyst,"This position is for experts based in the US, Canada, or EU ONLY. All others, please apply to the 'Global' position.
This is a remote, part-time role in medical data annotation. You'll interpret medical tables such as clinical trial results, lab reports, and treatment comparisons. You'll write problem sets and explanations to help train medical reasoning in AI systems.","Ability to interpret medical tables and statistical results
Familiarity with medical terminology and study design
Excited to improve the future of AI application","Write explanations based on clinical or lab-based data
Generate instruction-based reasoning to evaluate medical tables
Follow a high standard of accuracy and documentation"
Medical MD Expert,Healthcare,$40 - $80/hr,"Apr 13, 2025",https://experts.afterquery.com/apply/medical-md-expert,"AfterQuery is searching for Medical MD Experts to design and evaluate complex medical scenarios that drive the training of our advanced AI systems. In this remote, flexible role, you will craft case studies and decision-making challenges that reflect real-world clinical and healthcare dilemmas. Your deep clinical expertise will be essential in ensuring our AI models can navigate the nuanced world of medical practice with accuracy, empathy, and up-to-date knowledge.","Medical Doctor (MD) degree from an accredited institution with current licensure in a recognized jurisdiction.
Proven clinical or academic experience that demonstrates expertise in modern medical practices and healthcare delivery.
Exceptional analytical, written, and verbal communication skills, with the ability to articulate complex medical scenarios clearly.","Develop detailed medical case studies and clinical scenarios that challenge AI models to make informed, nuanced decisions.
Evaluate AI-generated responses for clinical accuracy, logical consistency, and adherence to current medical guidelines.
Collaborate with a cross-functional team to refine case difficulty and ensure the content reflects real-world medical challenges and best practices."
Nonprofit / Impact Analyst Expert,Nonprofit,$30 - $70/hr,"Mar 25, 2025",https://experts.afterquery.com/apply/nonprofit-impact-analyst,"As a part-time Nonprofit / Impact Analyst, you'll replicate tasks such as setting up donor segmentation models,
tracking fundraising progress against goals, and computing the ROI of specific initiatives. You'll build Excel-based dashboards and
produce PowerPoint decks that translate these metrics into compelling narratives about the organization's mission and achievements.

By contributing these workflow examples, you'll help AfterQuery enrich its AI training datasets with the unique constraints and
objectives of nonprofit organizations—ranging from grant reporting to community outreach evaluation.","Experience in nonprofit or social impact analytics
Advanced Excel for budgeting, forecasting, or ROI analyses
Strong PowerPoint storytelling skills geared toward donors, boards, or executives","Develop Excel models for donor segmentation, fundraising tracking, and impact metrics
Create PowerPoint presentations highlighting program outcomes, success stories, and challenges
Analyze and visualize data to guide resource allocation decisions and strategic planning
Collaborate with nonprofit leadership to ensure data accuracy and mission alignment"
Physics PhD Expert,Physics,$45/hr,"Apr 12, 2025",https://experts.afterquery.com/apply/physics-phd-expert,"AfterQuery is searching for a Physics PhD Expert to craft, review, and enhance physics-related reasoning problems to advance our AI labs. In this remote, flexible position, you will develop high-quality, real-world physics questions and verify the logical consistency of model responses. Your advanced expertise in physics will be crucial for ensuring that our AI systems accurately interpret and solve complex physics challenges while adhering to current scientific principles.","PhD in Physics or a related discipline such as Astronomy, Astrophysics, or Engineering Physics
At least 2 years of experience in academic research, teaching, or applied physics environments
Strong analytical skills with the ability to interpret complex phenomena and communicate scientific concepts effectively","Design well-structured, undergraduate to advanced-level physics questions that challenge reasoning and conceptual understanding
Validate solution accuracy and refine problem difficulty, ensuring each prompt promotes critical thinking over mere computation
Analyze model responses, offering detailed feedback to improve clarity and scientific rigor in test items"
PowerPoint Expert (To Start Immediately),Powerpoint,$30 - $70/hr,"May 9, 2025",https://experts.afterquery.com/apply/ppt-expert,"You must be able to start immediately and work 6-8 hours over the next two days. This role is ideal for candidates with advanced PowerPoint skills who can build clean, complex presentations, analyze and interpret data, and generate a narrative. We are agnostic to your background and look for a diverse set of candidates from different industries.","Strong proficiency in PowerPoint, including formatting, data visualization, graphic design, charts, etc.
Attention to detail and ability to design clear, error-free presentations
Ability to communicate modeling logic and walk others through your work","Build detailed and professional-grade PowerPoint presentations based on Excel data analyses
Parse complex data and conclusions to clearly communicate actionable insights
Design intuitive templates, trackers, or dashboards tailored to specific business use cases"
Product Management (Analytics-Focused) Expert,Product Management,$40 - $90/hr,"Mar 25, 2025",https://experts.afterquery.com/apply/pm-analytics,"In this part-time, analytics-focused Product Management role, you'll use Excel to gather data from multiple sources,
refine it into actionable metrics, and evaluate the viability of product features or enhancements. Projects may involve user funnel
analyses, A/B test interpretations, or investigating market opportunities for new feature sets.

You will also craft PowerPoint decks that present these insights to cross-functional teams, ensuring they have a clear understanding of
roadmap priorities, high-level KPIs, and potential ROI. Your deliverables will closely mimic real-world product decision-making workflows,
reinforcing AfterQuery's mission to provide high-quality AI training data.","Proven track record in product analytics or data-driven product management
Advanced Excel usage for scenario modeling and data analysis
Excellent PowerPoint presentation and storytelling skills","Conduct market and user behavior analyses in Excel (e.g., cohort retention, cost of acquisition)
Produce product feature cost-benefit or ROI models for internal review
Develop PowerPoint decks for product vision, roadmap proposals, and KPI updates
Collaborate with engineers, designers, and other stakeholders to align priorities"
Project Management Expert,Project Management,$35 - $75/hr,"Mar 25, 2025",https://experts.afterquery.com/apply/pmo-analyst,"As a Project Management Experts, you'll create and maintain Excel tools that track project milestones, deliverables, risks, and resource allocations. You'll also develop PowerPoint presentations for stakeholders, distilling complex project data into intuitive visuals and executive summaries. Your work will simulate real-world product management scenarios—like creating status updates for a program steering committee or re-allocating budgets and staffing in response to shifting priorities. By contributing authentic examples of product management deliverables, you're helping AfterQuery generate high-caliber AI training data in project management.","Strong Excel skills (Gantt charts, pivot tables, formulas)
Experience creating executive-ready PowerPoint reports
Background in PMO, project coordination, or operations","Design Excel trackers for schedules, risks/issues, and budget utilization
Develop PowerPoint updates showcasing project progress and key decisions
Conduct resource modeling to identify constraints or bottlenecks
Collaborate with cross-functional teams to meet critical deadlines"
Python Software Engineer,Coding,$30 - $60/hr,"Feb 15, 2025",https://experts.afterquery.com/apply/python,We are seeking skilled programmers on a contract basis to generate high-quality python code samples. This is a flexible remote position requiring 5-20 hours of work per week.,"Strong coding skills in Python
Undergrad degree completed or in-progress in relevant field
Internship or full-time experience from a reputable technology company
Strong familiarity with git and GitHub
Based in the US or Canada","Create diverse, well-structured python code samples
Resolve git and GitHub-related issues on open-source projects
Diagnose and fix merge conflicts, branching problems, and repository errors
Review and implement pull requests to address codebase issues
Implement bug fixes
Provide clear comments and documentation within code
Develop code that demonstrates best practices and follows industry standards"
Quality Assurance Analyst,Quality,N/A,"May 1, 2025",https://experts.afterquery.com/apply/quality-assurance,Apply here,,
Quant Expert (Professional/Internship experience needed),Quant,$80-120/hr+,"Jun 20, 2025",https://experts.afterquery.com/apply/quant,"Formulate trading hypotheses, source data, and build research prototypes. Implement robust backtests that account for transaction costs, slippage, and regime changes.","At least one of the following:
Professional Experience at a Quant Firm
Incoming Professional at a Quant Firm
Internship Experience at a Quant Firm","Formulate trading hypotheses, source data, and build research prototypes
Implement robust backtests that account for transaction costs, slippage, and regime changes
Analyze performance, diagnose bias or overfitting, and iterate on model design
Be available for short projects"
Real Estate Investment Analyst Expert,Real Estate,$40 - $90/hr,"Mar 25, 2025",https://experts.afterquery.com/apply/real-estate-analyst,"As a part-time Real Estate Investment Analyst, you'll simulate the underwriting and presentation work typical in real estate
private equity, brokerages, or development firms. Projects include creating Excel-based financial projections (e.g., IRR analyses, cap rate
comparisons, and financing structures) and building PowerPoint decks for potential investors or internal approval committees.

Through your anonymized real estate deliverables, you'll help AfterQuery compile AI training datasets that capture the nuanced workflows
behind property evaluation and acquisition decisions.","Prior experience in real estate financial analysis, underwriting, or acquisitions
Advanced Excel skills for multi-year performance modeling, sensitivity testing
Ability to design polished investor presentations in PowerPoint","Develop Excel models detailing cash flow projections, IRR, sensitivity analyses, and scenario planning
Create PowerPoint-based property overviews, investment theses, and comparative market analyses
Conduct market research to identify key trends, comps, and local demand drivers
Summarize deal feasibility and risk factors for investor or internal review"
Risk Management / Credit Analyst Expert,Risk Management,$40 - $85/hr,"Mar 25, 2025",https://experts.afterquery.com/apply/risk-credit-analyst,"This part-time Risk Management / Credit Analyst role enables you to replicate the daily tasks of a corporate risk team,
bank, or fintech credit department. You'll build sophisticated Excel models that measure PD (probability of default), LGD (loss given default),
or stress test various economic scenarios. Alongside these data-heavy tasks, you'll produce executive-ready PowerPoint decks outlining
exposures, proposed credit policies, and recommended risk mitigation actions.

AfterQuery will use these anonymized risk deliverables to train AI in financial risk reasoning—a crucial domain that impacts global markets and banking.","Background in risk management, credit analysis, or related fields
Experience building Excel-based scenario analyses and scorecards
Ability to create succinct PowerPoint decks for senior leadership","Construct Excel scorecards for credit analysis, stress testing, and default probability calculations
Summarize risk findings in PowerPoint for executive committees or credit policy reviews
Analyze macroeconomic or market data to inform risk appetite decisions
Offer recommendations to refine credit policies and reduce exposure"
Sales Operations Analyst Expert,Sales Operations,$35 - $80/hr,"Mar 25, 2025",https://experts.afterquery.com/apply/sales-ops-analyst,"This part-time Sales Operations Analyst role involves creating Excel models that forecast bookings, track pipelines,
and measure key performance indicators (KPIs) such as quota attainment, average deal size, and sales cycle length.
You'll convert your data-driven insights into professional PowerPoint presentations for C-level or VP-level audiences.

Projects may include territory design, commission calculations, capacity planning, and revenue predictions based on historical trends.
Your deliverables will reflect real-world sales operations processes, helping AfterQuery build top-tier AI training datasets that mirror actual business environments.","Background in sales operations, revenue operations, or a similar function
Proficiency in Excel for forecasting (regression, pivot tables), data manipulation
Skilled at PowerPoint storytelling (charts, data visualizations, executive summaries)","Build Excel models for sales forecasting and quota attainment
Create PowerPoint decks presenting pipeline health and performance insights
Track KPIs such as win rates, ACV, conversion ratios, and pipeline velocity
Collaborate with sales leadership to refine processes and identify revenue opportunities"
