title,location,first_published,updated_at,url,description_raw
Science Specialist – AI Trainer,India,2025-06-16T16:58:17-04:00,2025-06-24T14:37:11-04:00,https://job-boards.eu.greenhouse.io/agency/jobs/4607790101,"{""science specialist – ai trainer"": ""Are you a science specialist eager to shape the future of AI? Large-scale language models are evolving from clever chatbots into powerful engines of scientific discovery. With high-quality training data, tomorrow’s AI can democratize world-class education, keep pace with cutting-edge research, and streamline problem-solving for scientists and learners everywhere. That training data begins with you—we need your expertise to help power the next generation of AI. We’re looking for science specialists who live and breathe physical science, earth science, environmental science, chemistry, physics, astronomy, and scientific literacy. You’ll challenge advanced language models on topics like energy transformation, atomic structure, planetary motion, ecological systems, the water cycle, and scientific inquiry—documenting every failure mode so we can harden model reasoning. On a typical day, you will converse with the model on real-world scenarios and theoretical science questions, verify factual accuracy and logical soundness, capture reproducible error traces, and suggest improvements to our prompt engineering and evaluation metrics. A bachelor’s, master’s, or PhD in a science field is ideal; teaching experience, published work, lab or field research, or science communication projects signal fit. Clear, metacognitive communication—“showing your work”—are essential. Ready to turn your science expertise into the knowledge base for tomorrow’s AI? Apply today and start teaching the model that will teach the world. We offer a pay range of $8 to $65 per hour, with the exact rate determined after evaluating your experience, expertise, and geographic location. Final offer amounts may vary from the pay range listed above. As a contractor, you’ll supply a secure computer and high-speed internet; company-sponsored benefits such as health insurance and PTO do not apply. Job title: Science Specialist – AI Trainer Employment type: Contract Workplace type: Remote Seniority level: Mid - Senior Level"", ""apply for this job"": ""* indicates a required field Accepted file types: pdf, doc, docx, txt, rtf Education Proficiency means you can effectively communicate complex ideas, including academic or cognitively challenging topics, both verbally and in writing. This includes the ability to participate in professional conversations, explain nuanced concepts, and understand detailed instructions in the selected language(s) Please enter your desired hourly rate in USD as a number only (no symbols, words, or ranges). Decimals are allowed. Do not include $, commas, or text."", ""number only"": ""Example: 8.50 (for $8.50/hour)"", ""example:"": ""Please enter the number of hours you are generally available each week using numbers only . Decimals are allowed. Do not include text or symbols. By clicking \""Submit Application\"", you agree to Invisible's Privacy Policy . Powered by Read our Privacy Policy"", ""not"": ""Example: 40 or 32.5""}"
Science Specialist – AI Trainer,World Wide - Remote,2025-06-16T16:57:50-04:00,2025-06-24T14:37:10-04:00,https://job-boards.eu.greenhouse.io/agency/jobs/4607789101,"{""science specialist – ai trainer"": ""Are you a science specialist eager to shape the future of AI? Large-scale language models are evolving from clever chatbots into powerful engines of scientific discovery. With high-quality training data, tomorrow’s AI can democratize world-class education, keep pace with cutting-edge research, and streamline problem-solving for scientists and learners everywhere. That training data begins with you—we need your expertise to help power the next generation of AI. We’re looking for science specialists who live and breathe physical science, earth science, environmental science, chemistry, physics, astronomy, and scientific literacy. You’ll challenge advanced language models on topics like energy transformation, atomic structure, planetary motion, ecological systems, the water cycle, and scientific inquiry—documenting every failure mode so we can harden model reasoning. On a typical day, you will converse with the model on real-world scenarios and theoretical science questions, verify factual accuracy and logical soundness, capture reproducible error traces, and suggest improvements to our prompt engineering and evaluation metrics. A bachelor’s, master’s, or PhD in a science field is ideal; teaching experience, published work, lab or field research, or science communication projects signal fit. Clear, metacognitive communication—“showing your work”—are essential. Ready to turn your science expertise into the knowledge base for tomorrow’s AI? Apply today and start teaching the model that will teach the world. We offer a pay range of $8 to $65 per hour, with the exact rate determined after evaluating your experience, expertise, and geographic location. Final offer amounts may vary from the pay range listed above. As a contractor, you’ll supply a secure computer and high-speed internet; company-sponsored benefits such as health insurance and PTO do not apply. Job title: Science Specialist – AI Trainer Employment type: Contract Workplace type: Remote Seniority level: Mid - Senior Level"", ""apply for this job"": ""* indicates a required field Accepted file types: pdf, doc, docx, txt, rtf Education Proficiency means you can effectively communicate complex ideas, including academic or cognitively challenging topics, both verbally and in writing. This includes the ability to participate in professional conversations, explain nuanced concepts, and understand detailed instructions in the selected language(s) Please enter your desired hourly rate in USD as a number only (no symbols, words, or ranges). Decimals are allowed. Do not include $, commas, or text."", ""number only"": ""Example: 8.50 (for $8.50/hour)"", ""example:"": ""Please enter the number of hours you are generally available each week using numbers only . Decimals are allowed. Do not include text or symbols. By clicking \""Submit Application\"", you agree to Invisible's Privacy Policy . Powered by Read our Privacy Policy"", ""not"": ""Example: 40 or 32.5""}"
Science Specialist (Fluent in Arabic) – AI Trainer,World Wide - Remote,2025-06-16T16:44:10-04:00,2025-06-24T14:37:14-04:00,https://job-boards.eu.greenhouse.io/agency/jobs/4607773101,"{""science specialist (fluent in arabic) – ai trainer"": ""Are you a science specialist fluent in Arabic, eager to shape the future of AI? Large-scale language models are evolving from clever chatbots into powerful engines of scientific discovery. With high-quality training data, tomorrow’s AI can democratize world-class education, keep pace with cutting-edge research, and streamline problem-solving for scientists and learners everywhere. That training data begins with you—we need your expertise to help power the next generation of AI. We’re looking for science specialists who live and breathe physical science, earth science, environmental science, chemistry, physics, astronomy, and scientific literacy. You’ll challenge advanced language models on topics like energy transformation, atomic structure, planetary motion, ecological systems, the water cycle, and scientific inquiry—documenting every failure mode so we can harden model reasoning. On a typical day, you will converse with the model on real-world scenarios and theoretical science questions, verify factual accuracy and logical soundness, capture reproducible error traces, and suggest improvements to our prompt engineering and evaluation metrics. A bachelor’s, master’s, or PhD in a science field is ideal; teaching experience, published work, lab or field research, or science communication projects signal fit. Fluency in Arabic and clear, metacognitive communication—“showing your work”—are essential. Ready to turn your science expertise into the knowledge base for tomorrow’s AI? Apply today and start teaching the model that will teach the world. We offer a pay range of $8 to $65 per hour, with the exact rate determined after evaluating your experience, expertise, and geographic location. Final offer amounts may vary from the pay range listed above. As a contractor, you’ll supply a secure computer and high-speed internet; company-sponsored benefits such as health insurance and PTO do not apply. Job title: Science Specialist – AI Trainer (Fluent in Arabic) Employment type: Contract Workplace type: Remote Seniority level: Mid - Senior Level"", ""apply for this job"": ""* indicates a required field Accepted file types: pdf, doc, docx, txt, rtf Education Proficiency means you can effectively communicate complex ideas, including academic or cognitively challenging topics, both verbally and in writing. This includes the ability to participate in professional conversations, explain nuanced concepts, and understand detailed instructions in the selected language(s) Please enter your desired hourly rate in USD as a number only (no symbols, words, or ranges). Decimals are allowed. Do not include $, commas, or text."", ""number only"": ""Example: 8.50 (for $8.50/hour)"", ""example:"": ""Please enter the number of hours you are generally available each week using numbers only . Decimals are allowed. Do not include text or symbols. By clicking \""Submit Application\"", you agree to Invisible's Privacy Policy . Powered by Read our Privacy Policy"", ""not"": ""Example: 40 or 32.5""}"
Science Specialist (Fluent in Dutch) – AI Trainer,World Wide - Remote,2025-06-16T16:54:08-04:00,2025-06-24T14:37:16-04:00,https://job-boards.eu.greenhouse.io/agency/jobs/4607785101,"{""science specialist (fluent in dutch) – ai trainer"": ""Are you a science specialist fluent in Dutch, eager to shape the future of AI? Large-scale language models are evolving from clever chatbots into powerful engines of scientific discovery. With high-quality training data, tomorrow’s AI can democratize world-class education, keep pace with cutting-edge research, and streamline problem-solving for scientists and learners everywhere. That training data begins with you—we need your expertise to help power the next generation of AI. We’re looking for science specialists who live and breathe physical science, earth science, environmental science, chemistry, physics, astronomy, and scientific literacy. You’ll challenge advanced language models on topics like energy transformation, atomic structure, planetary motion, ecological systems, the water cycle, and scientific inquiry—documenting every failure mode so we can harden model reasoning. On a typical day, you will converse with the model on real-world scenarios and theoretical science questions, verify factual accuracy and logical soundness, capture reproducible error traces, and suggest improvements to our prompt engineering and evaluation metrics. A bachelor’s, master’s, or PhD in a science field is ideal; teaching experience, published work, lab or field research, or science communication projects signal fit. Fluency in Dutch and clear, metacognitive communication—“showing your work”—are essential. Ready to turn your science expertise into the knowledge base for tomorrow’s AI? Apply today and start teaching the model that will teach the world. We offer a pay range of $8 to $65 per hour, with the exact rate determined after evaluating your experience, expertise, and geographic location. Final offer amounts may vary from the pay range listed above. As a contractor, you’ll supply a secure computer and high-speed internet; company-sponsored benefits such as health insurance and PTO do not apply. Job title: Science Specialist – AI Trainer (Fluent in Dutch) Employment type: Contract Workplace type: Remote Seniority level: Mid - Senior Level"", ""apply for this job"": ""* indicates a required field Accepted file types: pdf, doc, docx, txt, rtf Education Proficiency means you can effectively communicate complex ideas, including academic or cognitively challenging topics, both verbally and in writing. This includes the ability to participate in professional conversations, explain nuanced concepts, and understand detailed instructions in the selected language(s) Please enter your desired hourly rate in USD as a number only (no symbols, words, or ranges). Decimals are allowed. Do not include $, commas, or text."", ""number only"": ""Example: 8.50 (for $8.50/hour)"", ""example:"": ""Please enter the number of hours you are generally available each week using numbers only . Decimals are allowed. Do not include text or symbols. By clicking \""Submit Application\"", you agree to Invisible's Privacy Policy . Powered by Read our Privacy Policy"", ""not"": ""Example: 40 or 32.5""}"
Science Specialist (Fluent in French) – AI Trainer,World Wide - Remote,2025-06-16T16:53:33-04:00,2025-06-24T14:37:15-04:00,https://job-boards.eu.greenhouse.io/agency/jobs/4607784101,"{""science specialist (fluent in french) – ai trainer"": ""Are you a science specialist fluent in French, eager to shape the future of AI? Large-scale language models are evolving from clever chatbots into powerful engines of scientific discovery. With high-quality training data, tomorrow’s AI can democratize world-class education, keep pace with cutting-edge research, and streamline problem-solving for scientists and learners everywhere. That training data begins with you—we need your expertise to help power the next generation of AI. We’re looking for science specialists who live and breathe physical science, earth science, environmental science, chemistry, physics, astronomy, and scientific literacy. You’ll challenge advanced language models on topics like energy transformation, atomic structure, planetary motion, ecological systems, the water cycle, and scientific inquiry—documenting every failure mode so we can harden model reasoning. On a typical day, you will converse with the model on real-world scenarios and theoretical science questions, verify factual accuracy and logical soundness, capture reproducible error traces, and suggest improvements to our prompt engineering and evaluation metrics. A bachelor’s, master’s, or PhD in a science field is ideal; teaching experience, published work, lab or field research, or science communication projects signal fit. Fluency in French and clear, metacognitive communication—“showing your work”—are essential. Ready to turn your science expertise into the knowledge base for tomorrow’s AI? Apply today and start teaching the model that will teach the world. We offer a pay range of $8 to $65 per hour, with the exact rate determined after evaluating your experience, expertise, and geographic location. Final offer amounts may vary from the pay range listed above. As a contractor, you’ll supply a secure computer and high-speed internet; company-sponsored benefits such as health insurance and PTO do not apply. Job title: Science Specialist – AI Trainer (Fluent in French) Employment type: Contract Workplace type: Remote Seniority level: Mid - Senior Level"", ""apply for this job"": ""* indicates a required field Accepted file types: pdf, doc, docx, txt, rtf Education Proficiency means you can effectively communicate complex ideas, including academic or cognitively challenging topics, both verbally and in writing. This includes the ability to participate in professional conversations, explain nuanced concepts, and understand detailed instructions in the selected language(s) Please enter your desired hourly rate in USD as a number only (no symbols, words, or ranges). Decimals are allowed. Do not include $, commas, or text."", ""number only"": ""Example: 8.50 (for $8.50/hour)"", ""example:"": ""Please enter the number of hours you are generally available each week using numbers only . Decimals are allowed. Do not include text or symbols. By clicking \""Submit Application\"", you agree to Invisible's Privacy Policy . Powered by Read our Privacy Policy"", ""not"": ""Example: 40 or 32.5""}"
Science Specialist (Fluent in German) – AI Trainer,World Wide - Remote,2025-06-16T16:51:29-04:00,2025-06-24T14:37:14-04:00,https://job-boards.eu.greenhouse.io/agency/jobs/4607781101,"{""science specialist (fluent in german) – ai trainer"": ""Are you a science specialist fluent in German, eager to shape the future of AI? Large-scale language models are evolving from clever chatbots into powerful engines of scientific discovery. With high-quality training data, tomorrow’s AI can democratize world-class education, keep pace with cutting-edge research, and streamline problem-solving for scientists and learners everywhere. That training data begins with you—we need your expertise to help power the next generation of AI. We’re looking for science specialists who live and breathe physical science, earth science, environmental science, chemistry, physics, astronomy, and scientific literacy. You’ll challenge advanced language models on topics like energy transformation, atomic structure, planetary motion, ecological systems, the water cycle, and scientific inquiry—documenting every failure mode so we can harden model reasoning. On a typical day, you will converse with the model on real-world scenarios and theoretical science questions, verify factual accuracy and logical soundness, capture reproducible error traces, and suggest improvements to our prompt engineering and evaluation metrics. A bachelor’s, master’s, or PhD in a science field is ideal; teaching experience, published work, lab or field research, or science communication projects signal fit. Fluency in German and clear, metacognitive communication—“showing your work”—are essential. Ready to turn your science expertise into the knowledge base for tomorrow’s AI? Apply today and start teaching the model that will teach the world. We offer a pay range of $8 to $65 per hour, with the exact rate determined after evaluating your experience, expertise, and geographic location. Final offer amounts may vary from the pay range listed above. As a contractor, you’ll supply a secure computer and high-speed internet; company-sponsored benefits such as health insurance and PTO do not apply. Job title: Science Specialist – AI Trainer (Fluent in German) Employment type: Contract Workplace type: Remote Seniority level: Mid - Senior Level"", ""apply for this job"": ""* indicates a required field Accepted file types: pdf, doc, docx, txt, rtf Education Proficiency means you can effectively communicate complex ideas, including academic or cognitively challenging topics, both verbally and in writing. This includes the ability to participate in professional conversations, explain nuanced concepts, and understand detailed instructions in the selected language(s) Please enter your desired hourly rate in USD as a number only (no symbols, words, or ranges). Decimals are allowed. Do not include $, commas, or text."", ""number only"": ""Example: 8.50 (for $8.50/hour)"", ""example:"": ""Please enter the number of hours you are generally available each week using numbers only . Decimals are allowed. Do not include text or symbols. By clicking \""Submit Application\"", you agree to Invisible's Privacy Policy . Powered by Read our Privacy Policy"", ""not"": ""Example: 40 or 32.5""}"
Science Specialist (Fluent in Hindi) – AI Trainer,World Wide - Remote,2025-06-16T16:49:29-04:00,2025-06-24T14:37:13-04:00,https://job-boards.eu.greenhouse.io/agency/jobs/4607778101,"{""science specialist (fluent in hindi) – ai trainer"": ""Are you a science specialist fluent in Hindi, eager to shape the future of AI? Large-scale language models are evolving from clever chatbots into powerful engines of scientific discovery. With high-quality training data, tomorrow’s AI can democratize world-class education, keep pace with cutting-edge research, and streamline problem-solving for scientists and learners everywhere. That training data begins with you—we need your expertise to help power the next generation of AI. We’re looking for science specialists who live and breathe physical science, earth science, environmental science, chemistry, physics, astronomy, and scientific literacy. You’ll challenge advanced language models on topics like energy transformation, atomic structure, planetary motion, ecological systems, the water cycle, and scientific inquiry—documenting every failure mode so we can harden model reasoning. On a typical day, you will converse with the model on real-world scenarios and theoretical science questions, verify factual accuracy and logical soundness, capture reproducible error traces, and suggest improvements to our prompt engineering and evaluation metrics. A bachelor’s, master’s, or PhD in a science field is ideal; teaching experience, published work, lab or field research, or science communication projects signal fit. Fluency in Hindi and clear, metacognitive communication—“showing your work”—are essential. Ready to turn your science expertise into the knowledge base for tomorrow’s AI? Apply today and start teaching the model that will teach the world. We offer a pay range of $8 to $65 per hour, with the exact rate determined after evaluating your experience, expertise, and geographic location. Final offer amounts may vary from the pay range listed above. As a contractor, you’ll supply a secure computer and high-speed internet; company-sponsored benefits such as health insurance and PTO do not apply. Job title: Science Specialist – AI Trainer (Fluent in Hindi) Employment type: Contract Workplace type: Remote Seniority level: Mid - Senior Level"", ""apply for this job"": ""* indicates a required field Accepted file types: pdf, doc, docx, txt, rtf Education Proficiency means you can effectively communicate complex ideas, including academic or cognitively challenging topics, both verbally and in writing. This includes the ability to participate in professional conversations, explain nuanced concepts, and understand detailed instructions in the selected language(s) Please enter your desired hourly rate in USD as a number only (no symbols, words, or ranges). Decimals are allowed. Do not include $, commas, or text."", ""number only"": ""Example: 8.50 (for $8.50/hour)"", ""example:"": ""Please enter the number of hours you are generally available each week using numbers only . Decimals are allowed. Do not include text or symbols. By clicking \""Submit Application\"", you agree to Invisible's Privacy Policy . Powered by Read our Privacy Policy"", ""not"": ""Example: 40 or 32.5""}"
